rank,pmid,doi,title,year,journal,primary_theme,all_themes,study_tier,pubtypes,citation_count,citations_per_year,rcr,yogic_weighted,bidmc_sadhguru_center,null_or_critical,selection_score,last_author
1,28963884,10.1016/j.psyneuen.2017.08.008,"Yoga, mindfulness-based stress reduction and stress-related physiological measures: A meta-analysis",2017,Psychoneuroendocrinology,Stress & Anxiety,Stress & Anxiety | Brain & Mechanisms | Clinical Research,Meta-analysis / Systematic review,Journal Article; Meta-Analysis; Systematic Review,269,29.89,15.02,Y,N,Y,27.8,Ski CF
2,32590814,10.1097/MD.0000000000020992,Interventions to reduce burnout of physicians and nurses: An overview of systematic reviews and meta-analyses,2020,Medicine,Stress & Anxiety,Stress & Anxiety | Emotional Wellbeing | Brain & Mechanisms,Meta-analysis / Systematic review,Journal Article; Meta-Analysis; Systematic Review,148,24.67,16.08,Y,N,Y,27.8,Shi TY
3,34952171,10.1016/j.jpainsymman.2021.12.021,Psychological and Non-Pharmacologic Treatments for Pain in Cancer Patients: A Systematic Review and Meta-Analysis,2022,Journal of pain and symptom management,Clinical Research,Clinical Research | Brain & Mechanisms,Meta-analysis / Systematic review,"Journal Article; Meta-Analysis; Systematic Review; Research Support, Non-U.S. Gov't",74,18.5,8.71,Y,N,Y,27.8,Moriana JA
4,37385740,10.1136/bmjopen-2022-071203,"Workplace interventions to improve well-being and reduce burnout for nurses, physicians and allied healthcare professionals: a systematic review",2023,BMJ open,Stress & Anxiety,Stress & Anxiety | Emotional Wellbeing,Meta-analysis / Systematic review,Systematic Review; Journal Article,291,97.0,69.14,Y,N,N,27.0,Childs J
5,34627209,10.1186/s12905-021-01500-4,Effect of physical activity and exercise on endometriosis-associated symptoms: a systematic review,2021,BMC women's health,Stress & Anxiety,Stress & Anxiety | Clinical Research,Meta-analysis / Systematic review,Journal Article; Meta-Analysis; Systematic Review,60,12.0,6.31,Y,N,N,27.0,Tellum T
6,28192789,10.7326/M16-2367,"Noninvasive Treatments for Acute, Subacute, and Chronic Low Back Pain: A Clinical Practice Guideline From the American College of Physicians",2017,Annals of internal medicine,Stress & Anxiety,Stress & Anxiety,Meta-analysis / Systematic review,Journal Article; Practice Guideline,2155,239.44,136.33,Y,N,N,27.0,Vijan S
7,38669625,10.1097/GME.0000000000002336,Effects of mind-body exercise on perimenopausal and postmenopausal women: a systematic review and meta-analysis,2024,"Menopause (New York, N.Y.)",Stress & Anxiety,Stress & Anxiety | Sleep | Focus & Attention | Emotional Wellbeing | Clinical Research,Meta-analysis / Systematic review,"Journal Article; Systematic Review; Meta-Analysis; Research Support, Non-U.S. Gov't",35,17.5,12.24,Y,N,N,27.0,Liang Y
8,29697885,10.1002/da.22762,Yoga for anxiety: A systematic review and meta-analysis of randomized controlled trials,2018,Depression and anxiety,Stress & Anxiety,Stress & Anxiety | Emotional Wellbeing | Clinical Research,Meta-analysis / Systematic review,Journal Article; Meta-Analysis; Systematic Review,175,21.88,12.1,Y,N,N,27.0,Ward L
9,27502816,10.1016/j.ctcp.2016.06.005,Yoga research review,2016,Complementary therapies in clinical practice,Stress & Anxiety,Stress & Anxiety | Emotional Wellbeing | Clinical Research,Meta-analysis / Systematic review,Journal Article; Review,105,10.5,6.48,Y,N,N,27.0,Field T
10,23922209,10.1002/da.22166,Yoga for depression: a systematic review and meta-analysis,2013,Depression and anxiety,Stress & Anxiety,Stress & Anxiety | Emotional Wellbeing | Clinical Research,Meta-analysis / Systematic review,"Journal Article; Meta-Analysis; Research Support, Non-U.S. Gov't; Systematic Review",381,29.31,17.11,Y,N,N,27.0,Dobos G
11,28436583,10.1002/14651858.CD011279.pub3,Physical activity and exercise for chronic pain in adults: an overview of Cochrane Reviews,2017,The Cochrane database of systematic reviews,Stress & Anxiety,Stress & Anxiety | Sleep | Emotional Wellbeing,Meta-analysis / Systematic review,Journal Article; Meta-Analysis; Systematic Review,708,78.67,44.76,Y,N,N,27.0,Smith BH
12,34464836,10.1016/j.midw.2021.103126,"Non-pharmacological interventions to reduce anxiety in pregnancy, labour and postpartum: A systematic review",2021,Midwifery,Stress & Anxiety,Stress & Anxiety,Meta-analysis / Systematic review,Journal Article; Systematic Review,55,11.0,6.23,Y,N,N,27.0,Lima-Rodríguez JS
13,38137060,10.3390/brainsci13121612,Breathing Practices for Stress and Anxiety Reduction: Conceptual Framework of Implementation Guidelines Based on a Systematic Review of the Published Literature,2023,Brain sciences,Stress & Anxiety,Stress & Anxiety,Meta-analysis / Systematic review,Journal Article; Review,39,13.0,9.54,Y,N,N,27.0,Sprimont P
14,36053030,10.1002/14651858.CD012337.pub2,Conservative interventions for treating urinary incontinence in women: an Overview of Cochrane systematic reviews,2022,The Cochrane database of systematic reviews,Stress & Anxiety,Stress & Anxiety,Meta-analysis / Systematic review,"Journal Article; Research Support, Non-U.S. Gov't; Systematic Review",97,24.25,14.15,Y,N,N,27.0,McClurg D
15,38271440,10.1371/journal.pone.0278432,"Effects of relaxation interventions during pregnancy on maternal mental health, and pregnancy and newborn outcomes: A systematic review and meta-analysis",2024,PloS one,Stress & Anxiety,Stress & Anxiety | Emotional Wellbeing | Clinical Research,Meta-analysis / Systematic review,Meta-Analysis; Systematic Review; Journal Article,28,14.0,10.82,Y,N,N,27.0,Wells JCK
16,31861418,10.3390/ijerph17010022,Mind-Body Exercise for Anxiety and Depression in COPD Patients: A Systematic Review and Meta-Analysis,2019,International journal of environmental research and public health,Stress & Anxiety,Stress & Anxiety | Emotional Wellbeing,Meta-analysis / Systematic review,"Journal Article; Meta-Analysis; Research Support, Non-U.S. Gov't; Systematic Review",108,15.43,7.69,Y,N,N,27.0,Smith L
17,27409075,10.1186/s12913-016-1423-5,"Proceedings of the 3rd IPLeiria's International Health Congress : Leiria, Portugal. 6-7 May 2016",2016,BMC health services research,Stress & Anxiety,Stress & Anxiety | Sleep | Focus & Attention | Emotional Wellbeing | Clinical Research | Brief & App-Based Practice,Meta-analysis / Systematic review,Journal Article,350,35.0,19.01,Y,N,N,27.0,Rama L
18,36087457,10.1016/j.smrv.2022.101673,Comparative efficacy of exercise regimens on sleep quality in older adults: A systematic review and network meta-analysis,2022,Sleep medicine reviews,Sleep,Sleep,Meta-analysis / Systematic review,"Journal Article; Systematic Review; Research Support, Non-U.S. Gov't; Network Meta-Analysis",76,19.0,9.3,Y,N,N,27.0,Chiu HY
19,34850063,10.1093/milmed/usab497,Physical Exercise as Treatment for PTSD: A Systematic Review and Meta-Analysis,2022,Military medicine,Sleep,Sleep,Meta-analysis / Systematic review,"Journal Article; Meta-Analysis; Systematic Review; Research Support, Non-U.S. Gov't",78,19.5,10.05,Y,N,N,27.0,Ekblom Ö
20,28436999,10.3322/caac.21397,Clinical practice guidelines on the evidence-based use of integrative therapies during and after breast cancer treatment,2017,CA: a cancer journal for clinicians,Sleep,Sleep | Emotional Wellbeing | Clinical Research,Meta-analysis / Systematic review,Journal Article; Practice Guideline; Systematic Review,533,59.22,23.14,Y,N,N,27.0,Tripathy D
21,31109309,10.1186/s12885-019-5648-7,A comprehensive approach to rehabilitation interventions following breast cancer treatment - a systematic review of systematic reviews,2019,BMC cancer,Sleep,Sleep,Meta-analysis / Systematic review,Journal Article; Systematic Review,114,16.29,6.79,Y,N,N,27.0,Malmström M
22,40664502,10.1136/bmjebm-2024-113512,Effects of various exercise interventions in insomnia patients: a systematic review and network meta-analysis,2026,BMJ evidence-based medicine,Sleep,Sleep,Meta-analysis / Systematic review,Journal Article; Systematic Review; Meta-Analysis,7,7.0,7.0,Y,N,N,27.0,Liu ZL
23,28045199,10.1002/14651858.CD010802.pub2,"Yoga for improving health-related quality of life, mental health and cancer-related symptoms in women diagnosed with breast cancer",2017,The Cochrane database of systematic reviews,Sleep,Sleep,Meta-analysis / Systematic review,"Journal Article; Meta-Analysis; Research Support, Non-U.S. Gov't; Systematic Review",288,32.0,13.67,Y,N,N,27.0,Dobos GJ
24,32357858,10.1186/s12888-020-02566-4,The effect of yoga on sleep quality and insomnia in women with sleep problems: a systematic review and meta-analysis,2020,BMC psychiatry,Sleep,Sleep,Meta-analysis / Systematic review,"Journal Article; Meta-Analysis; Research Support, Non-U.S. Gov't; Systematic Review",89,14.83,7.58,Y,N,N,27.0,Chan YY
25,34163383,10.3389/fpsyt.2021.664499,Effects of Exercise on Sleep Quality and Insomnia in Adults: A Systematic Review and Meta-Analysis of Randomized Controlled Trials,2021,Frontiers in psychiatry,Sleep,Sleep,Meta-analysis / Systematic review,Systematic Review; Journal Article,129,25.8,12.73,Y,N,N,27.0,Wang W
26,31801099,10.1016/j.smrv.2019.101234,Interventions for sleep problems during pregnancy: A systematic review,2020,Sleep medicine reviews,Sleep,Sleep,Meta-analysis / Systematic review,"Journal Article; Research Support, Non-U.S. Gov't; Systematic Review",85,14.17,7.4,Y,N,N,27.0,Baglioni C
27,31443810,10.1016/j.jpsychores.2019.109756,Psychological and mind-body interventions for endometriosis: A systematic review,2019,Journal of psychosomatic research,Sleep,Sleep,Meta-analysis / Systematic review,Journal Article; Systematic Review,83,11.86,6.53,Y,N,N,27.0,Mikocka-Walus A
28,31538328,10.1002/14651858.CD004142.pub4,Exercise for dysmenorrhoea,2019,The Cochrane database of systematic reviews,Focus & Attention,Focus & Attention,Meta-analysis / Systematic review,Journal Article; Systematic Review,77,11.0,6.5,Y,N,N,27.0,Delshad E
29,26823546,10.1177/1362361315616002,A systematic review of the behavioural outcomes following exercise interventions for children and youth with autism spectrum disorder,2016,Autism : the international journal of research and practice,Focus & Attention,Focus & Attention,Meta-analysis / Systematic review,Journal Article; Systematic Review,140,14.0,7.12,Y,N,N,27.0,Lloyd M
30,25988743,10.1111/cch.12255,The effects of physical exercise in children with attention deficit hyperactivity disorder: a systematic review and meta-analysis of randomized control trials,2015,"Child: care, health and development",Focus & Attention,Focus & Attention,Meta-analysis / Systematic review,Journal Article; Meta-Analysis; Systematic Review,177,16.09,9.21,Y,N,N,27.0,Martínez-Vizcaíno V
31,32447717,10.1007/s40279-020-01292-x,Effects of Exercise Training Interventions on Executive Function in Older Adults: A Systematic Review and Meta-Analysis,2020,"Sports medicine (Auckland, N.Z.)",Focus & Attention,Focus & Attention,Meta-analysis / Systematic review,Journal Article; Meta-Analysis; Systematic Review,177,29.5,14.01,Y,N,N,27.0,Chang YK
32,26571279,10.11124/jbisrir-2015-2380,The effectiveness of mindfulness based programs in reducing stress experienced by nurses in adult hospital settings: a systematic review of quantitative evidence protocol,2015,JBI database of systematic reviews and implementation reports,Focus & Attention,Focus & Attention,Meta-analysis / Systematic review,Journal Article,107,9.73,6.57,Y,N,N,27.0,Purpora C
33,38355154,10.1136/bmj-2023-075847,Effect of exercise for depression: systematic review and network meta-analysis of randomised controlled trials,2024,BMJ (Clinical research ed.),Emotional Wellbeing,Emotional Wellbeing,Meta-analysis / Systematic review,Systematic Review; Journal Article; Network Meta-Analysis,444,222.0,126.36,Y,N,N,27.0,Lonsdale C
34,30245619,10.3389/fnhum.2018.00353,How Breath-Control Can Change Your Life: A Systematic Review on Psycho-Physiological Correlates of Slow Breathing,2018,Frontiers in human neuroscience,Emotional Wellbeing,Emotional Wellbeing | Brain & Mechanisms,Meta-analysis / Systematic review,Journal Article,394,49.25,25.16,Y,N,N,27.0,Gemignani A
35,36398843,10.1002/14651858.CD010671.pub3,Yoga for chronic non-specific low back pain,2022,The Cochrane database of systematic reviews,Emotional Wellbeing,Emotional Wellbeing,Meta-analysis / Systematic review,"Journal Article; Research Support, N.I.H., Extramural; Systematic Review",44,11.0,6.21,Y,N,N,27.0,Berman BM
36,40539198,10.3748/wjg.v31.i22.106835,Exploring the gut-exercise link: A systematic review of gastrointestinal disorders in physical activity,2025,World journal of gastroenterology,Emotional Wellbeing,Emotional Wellbeing,Meta-analysis / Systematic review,Systematic Review; Journal Article,21,21.0,8.36,Y,N,N,27.0,Elbeltagi R
37,38035307,10.3389/fpubh.2023.1155225,Exercise intervention for patients with chronic low back pain: a systematic review and network meta-analysis,2023,Frontiers in public health,Clinical Research,Clinical Research,Meta-analysis / Systematic review,"Systematic Review; Journal Article; Research Support, Non-U.S. Gov't; Network Meta-Analysis",42,14.0,10.76,Y,N,N,27.0,Ding X
38,38754041,10.1200/JCO.24.00541,Management of Fatigue in Adult Survivors of Cancer: ASCO-Society for Integrative Oncology Guideline Update,2024,Journal of clinical oncology : official journal of the American Society of Clinical Oncology,Clinical Research,Clinical Research,Meta-analysis / Systematic review,"Journal Article; Practice Guideline; Systematic Review; Research Support, N.I.H., Extramural; Research Support, Non-U.S. Gov't",154,77.0,34.36,Y,N,N,27.0,Mustian K
39,34444189,10.3390/ijerph18168430,Effect of Home Exercise Training in Patients with Nonspecific Low-Back Pain: A Systematic Review and Meta-Analysis,2021,International journal of environmental research and public health,Clinical Research,Clinical Research,Meta-analysis / Systematic review,Journal Article; Meta-Analysis; Systematic Review,55,11.0,6.44,Y,N,N,27.0,Dutheil F
40,34326296,10.1097/j.pain.0000000000002416,Yoga for treating low back pain: a systematic review and meta-analysis,2022,Pain,Clinical Research,Clinical Research,Meta-analysis / Systematic review,Journal Article; Meta-Analysis; Systematic Review,54,13.5,7.57,Y,N,N,27.0,Cramer H
41,38518585,10.1016/j.cpr.2024.102414,A meta-analytic review of anger management activities that increase or decrease arousal: What fuels or douses rage?,2024,Clinical psychology review,Brief & App-Based Practice,Brief & App-Based Practice,Meta-analysis / Systematic review,Meta-Analysis; Journal Article; Review,20,10.0,6.5,Y,N,N,27.0,Bushman BJ
42,38590811,10.3389/fpubh.2024.1228271,Does nature-based social prescription improve mental health outcomes? A systematic review and meta-analysis,2024,Frontiers in public health,Brief & App-Based Practice,Brief & App-Based Practice,Meta-analysis / Systematic review,Journal Article; Meta-Analysis; Systematic Review,32,16.0,12.09,Y,N,N,27.0,Saeed MM
43,37150427,10.1016/j.apmr.2023.04.014,Effects of Breathing Exercises in Patients With Chronic Obstructive Pulmonary Disease: A Network Meta-analysis,2024,Archives of physical medicine and rehabilitation,Clinical Research,Clinical Research,Meta-analysis / Systematic review,Journal Article; Review; Network Meta-Analysis,16,8.0,5.92,Y,N,N,26.81,Chen O
44,36271367,10.1186/s12877-022-03510-9,Efficacy and evaluation of therapeutic exercises on adults with Parkinson's disease: a systematic review and network meta-analysis,2022,BMC geriatrics,Sleep,Sleep | Focus & Attention,Meta-analysis / Systematic review,"Systematic Review; Journal Article; Research Support, Non-U.S. Gov't; Network Meta-Analysis",46,11.5,5.77,Y,N,N,26.43,Wei J
45,34901069,10.3389/fmed.2021.756940,Exercise for Neuropathic Pain: A Systematic Review and Expert Consensus,2021,Frontiers in medicine,Stress & Anxiety,Stress & Anxiety | Emotional Wellbeing | Clinical Research,Meta-analysis / Systematic review,Systematic Review; Journal Article,66,13.2,5.76,Y,N,N,26.4,Wang XQ
46,40217183,10.1186/s12889-025-22570-1,The best approaches and doses of exercise for improving sleep quality: a network meta-analysis and dose-response relationship study,2025,BMC public health,Sleep,Sleep,Meta-analysis / Systematic review,Journal Article; Network Meta-Analysis; Systematic Review,13,13.0,5.74,Y,N,N,26.36,Pan Y
47,26186435,10.1097/PSY.0000000000000218,Yoga and Cognition: A Meta-Analysis of Chronic and Acute Effects,2015,Psychosomatic medicine,Focus & Attention,Focus & Attention,Meta-analysis / Systematic review,Journal Article; Meta-Analysis,109,9.91,5.53,Y,N,N,25.81,McAuley E
48,24395196,10.1001/jamainternmed.2013.13018,Meditation programs for psychological stress and well-being: a systematic review and meta-analysis,2014,JAMA internal medicine,Stress & Anxiety,Stress & Anxiety | Sleep | Focus & Attention | Emotional Wellbeing | Clinical Research | Brain & Mechanisms,Meta-analysis / Systematic review,"Journal Article; Meta-Analysis; Research Support, U.S. Gov't, P.H.S.; Systematic Review",1175,97.92,53.88,N,N,Y,25.8,Haythornthwaite JA
49,37879237,10.1016/j.psyneuen.2023.106415,Effectiveness of stress management interventions to change cortisol levels: a systematic review and meta-analysis,2024,Psychoneuroendocrinology,Stress & Anxiety,Stress & Anxiety | Brain & Mechanisms,Meta-analysis / Systematic review,"Meta-Analysis; Systematic Review; Journal Article; Research Support, Non-U.S. Gov't",39,19.5,11.63,N,N,Y,25.8,O'Connor DB
50,30714811,10.1037/ocp0000146,A systematic review and meta-analysis of workplace mindfulness training randomized controlled trials,2019,Journal of occupational health psychology,Stress & Anxiety,Stress & Anxiety | Sleep | Emotional Wellbeing | Brain & Mechanisms,Meta-analysis / Systematic review,Journal Article; Meta-Analysis; Systematic Review,120,17.14,10.55,N,N,Y,25.8,Sanderson K
51,35834503,10.1371/journal.pone.0269519,"The effects of mindfulness-based interventions on symptoms of depression, anxiety, and cancer-related fatigue in oncology patients: A systematic review and meta-analysis",2022,PloS one,Stress & Anxiety,Stress & Anxiety | Emotional Wellbeing | Clinical Research | Brain & Mechanisms,Meta-analysis / Systematic review,Journal Article; Meta-Analysis; Systematic Review,95,23.75,10.97,N,N,Y,25.8,Kiropoulos L
52,35247788,10.1016/j.ijnurstu.2022.104204,"Comparative efficacy of 11 non-pharmacological interventions on depression, anxiety, quality of life, and caregiver burden for informal caregivers of people with dementia: A systematic review and network meta-analysis",2022,International journal of nursing studies,Stress & Anxiety,Stress & Anxiety | Emotional Wellbeing | Brain & Mechanisms,Meta-analysis / Systematic review,Journal Article; Systematic Review; Network Meta-Analysis,136,34.0,17.14,N,N,Y,25.8,Wang Z
53,35187740,10.1111/jocn.16265,"Effectiveness of mindfulness-based interventions on psychological well-being, burnout and post-traumatic stress disorder among nurses: A systematic review and meta-analysis",2023,Journal of clinical nursing,Stress & Anxiety,Stress & Anxiety | Clinical Research | Brain & Mechanisms,Meta-analysis / Systematic review,Meta-Analysis; Systematic Review; Journal Article,63,21.0,17.52,N,N,Y,25.8,Wang W
54,34650179,10.1038/s41598-021-99882-w,A systematic review and meta-analysis of acceptance- and mindfulness-based interventions for DSM-5 anxiety disorders,2021,Scientific reports,Stress & Anxiety,Stress & Anxiety | Emotional Wellbeing | Brain & Mechanisms,Meta-analysis / Systematic review,"Journal Article; Meta-Analysis; Research Support, Non-U.S. Gov't; Systematic Review",61,12.2,6.39,N,N,Y,25.8,Cramer H
55,31743957,10.1111/aphw.12188,Mindfulness-Based Interventions for University Students: A Systematic Review and Meta-Analysis of Randomised Controlled Trials,2020,Applied psychology. Health and well-being,Stress & Anxiety,Stress & Anxiety | Sleep | Emotional Wellbeing | Clinical Research | Brain & Mechanisms,Meta-analysis / Systematic review,Journal Article; Meta-Analysis; Systematic Review,147,24.5,15.07,N,N,Y,25.8,Galante J
56,30575050,10.1111/nyas.13996,The effect of mindfulness meditation on sleep quality: a systematic review and meta-analysis of randomized controlled trials,2019,Annals of the New York Academy of Sciences,Sleep,Sleep | Focus & Attention | Brain & Mechanisms,Meta-analysis / Systematic review,Journal Article; Meta-Analysis; Systematic Review,259,37.0,18.1,N,N,Y,25.8,Gill JM
57,37942696,10.1097/AJP.0000000000001173,Mindfulness-based Interventions for Chronic Low Back Pain: A Systematic Review and Meta-analysis,2024,The Clinical journal of pain,Focus & Attention,Focus & Attention | Clinical Research | Brain & Mechanisms,Meta-analysis / Systematic review,Meta-Analysis; Systematic Review; Journal Article,21,10.5,7.78,N,N,Y,25.8,Edwards RR
58,37748597,10.1016/j.jpain.2023.09.013,Acceptance and Commitment Therapy for Chronic Pain: An Overview of Systematic Reviews with Meta-Analysis of Randomized Clinical Trials,2024,The journal of pain,Emotional Wellbeing,Emotional Wellbeing | Clinical Research | Brain & Mechanisms,Meta-analysis / Systematic review,"Journal Article; Meta-Analysis; Systematic Review; Research Support, Non-U.S. Gov't",44,22.0,15.68,N,N,Y,25.8,Cano-García FJ
59,25932596,10.1097/YIC.0000000000000078,Efficacy of treatments for anxiety disorders: a meta-analysis,2015,International clinical psychopharmacology,Brain & Mechanisms,Brain & Mechanisms,Meta-analysis / Systematic review,Journal Article; Meta-Analysis; Review,345,31.36,16.54,N,N,Y,25.8,Wedekind D
60,27317503,10.1016/j.math.2016.04.005,Exercises for mechanical neck disorders: A Cochrane review update,2016,Manual therapy,Brain & Mechanisms,Brain & Mechanisms,Meta-analysis / Systematic review,Journal Article; Meta-Analysis; Review,127,12.7,8.8,N,N,Y,25.8,Bronfort G
61,39968795,10.1111/head.14914,Behavioral interventions for migraine prevention: A systematic review and meta-analysis,2025,Headache,Brief & App-Based Practice,Brief & App-Based Practice | Brain & Mechanisms,Meta-analysis / Systematic review,"Journal Article; Systematic Review; Meta-Analysis; Research Support, Non-U.S. Gov't; Research Support, U.S. Gov't, Non-P.H.S.",23,23.0,10.07,N,N,Y,25.8,Mull NK
62,38450497,10.5664/jcsm.11106,Effects of different types of exercise on sleep quality based on Pittsburgh Sleep Quality Index in middle-aged and older adults: a network meta-analysis,2024,Journal of clinical sleep medicine : JCSM : official publication of the American Academy of Sleep Medicine,Sleep,Sleep,Meta-analysis / Systematic review,"Journal Article; Systematic Review; Network Meta-Analysis; Research Support, Non-U.S. Gov't",19,9.5,5.47,Y,N,N,25.67,Zhang P
63,37058254,10.1007/s11916-023-01107-4,Evidence-Based Treatment of Pain in Chemotherapy-Induced Peripheral Neuropathy,2023,Current pain and headache reports,Clinical Research,Clinical Research,Meta-analysis / Systematic review,Systematic Review; Journal Article,35,11.67,5.43,Y,N,N,25.59,Abd-Elsayed A
64,23796855,10.1016/j.cpr.2013.05.005,Mindfulness-based therapy: a comprehensive meta-analysis,2013,Clinical psychology review,Stress & Anxiety,Stress & Anxiety | Emotional Wellbeing,Meta-analysis / Systematic review,"Journal Article; Meta-Analysis; Research Support, N.I.H., Extramural; Systematic Review",886,68.15,41.38,N,N,N,25.0,Hofmann SG
65,25818837,10.1016/j.jpsychores.2015.03.009,Mindfulness-based stress reduction for healthy individuals: A meta-analysis,2015,Journal of psychosomatic research,Stress & Anxiety,Stress & Anxiety | Emotional Wellbeing,Meta-analysis / Systematic review,Journal Article; Meta-Analysis; Systematic Review,745,67.73,39.63,N,N,N,25.0,Fournier C
66,39595177,10.3390/biomedicines12112613,Neurobiological Changes Induced by Mindfulness and Meditation: A Systematic Review,2024,Biomedicines,Stress & Anxiety,Stress & Anxiety | Emotional Wellbeing | Brain & Mechanisms,Meta-analysis / Systematic review,Journal Article; Review,49,24.5,13.87,N,N,N,25.0,Calabrò RS
67,33905898,10.1016/j.nedt.2021.104877,"Reducing stress, anxiety and depression in undergraduate nursing students: Systematic review",2021,Nurse education today,Stress & Anxiety,Stress & Anxiety,Meta-analysis / Systematic review,Journal Article; Systematic Review,142,28.4,18.73,N,N,N,25.0,Kapp S
68,28863392,10.1016/j.jpsychires.2017.08.004,Mindfulness mediates the physiological markers of stress: Systematic review and meta-analysis,2017,Journal of psychiatric research,Stress & Anxiety,Stress & Anxiety | Focus & Attention | Emotional Wellbeing | Clinical Research,Meta-analysis / Systematic review,Journal Article; Meta-Analysis; Systematic Review,273,30.33,14.44,N,N,N,25.0,Ski CF
69,15256293,10.1016/S0022-3999(03)00573-7,Mindfulness-based stress reduction and health benefits. A meta-analysis,2004,Journal of psychosomatic research,Stress & Anxiety,Stress & Anxiety | Emotional Wellbeing | Clinical Research,Meta-analysis / Systematic review,"Journal Article; Meta-Analysis; Research Support, Non-U.S. Gov't",1703,77.41,57.92,N,N,N,25.0,Walach H
70,32338522,10.1177/0890117120920451,"Interventions to Improve Mental Health, Well-Being, Physical Health, and Lifestyle Behaviors in Physicians and Nurses: A Systematic Review",2020,American journal of health promotion : AJHP,Stress & Anxiety,Stress & Anxiety | Emotional Wellbeing,Meta-analysis / Systematic review,Journal Article; Meta-Analysis; Systematic Review,237,39.5,22.83,N,N,N,25.0,Bird SB
71,23246209,10.1016/j.jad.2012.11.026,Interventions to reduce stress in university students: a review and meta-analysis,2013,Journal of affective disorders,Stress & Anxiety,Stress & Anxiety | Emotional Wellbeing,Meta-analysis / Systematic review,Journal Article; Meta-Analysis; Systematic Review,410,31.54,21.42,N,N,N,25.0,Pitts A
